{
  "$schema": "https://json-schema.org/draft/2020-12/schema",
  "title": "data/site.json: lo general de la web",
  "description": "data/site.json: lo general de la web y qué proyectos salen. Este fichero lo lee VS Code (por el \"$schema\" de arriba del JSON) para autocompletar, explicar cada campo y subrayar lo que está mal; el build y la vista previa validan con él mismo.",
  "type": "object",
  "required": [
    "title",
    "url",
    "lists"
  ],
  "additionalProperties": false,
  "properties": {
    "$schema": {
      "type": "string"
    },
    "title": {
      "type": "string",
      "description": "El nombre de la web: sale en la pestaña, en Google y al compartir."
    },
    "url": {
      "type": "string",
      "pattern": "^https://",
      "description": "La dirección de la web, con su dominio: \"https://andreacarilla.work/\". Las direcciones de Google y de compartir salen de aquí."
    },
    "description": {
      "type": "string",
      "description": "La frase que sale en Google y al compartir la home."
    },
    "email": {
      "type": "string",
      "description": "Tu email: sale en «andrea carilla»."
    },
    "social": {
      "type": "array",
      "items": {
        "type": "string",
        "pattern": "^(https?://|mailto:)",
        "description": "Una dirección entera: https://…"
      },
      "description": "Tus redes, enteras: [\"https://www.instagram.com/andreacarilla/\"]."
    },
    "lists": {
      "type": "object",
      "description": "Las categorías, en orden: qué proyectos salen y dónde. Un proyecto que no está en ninguna no sale.",
      "additionalProperties": {
        "type": "object",
        "required": [
          "projects"
        ],
        "additionalProperties": false,
        "properties": {
          "name": {
            "type": "string",
            "description": "El nombre de la categoría en los filtros de la home."
          },
          "projects": {
            "type": "array",
            "description": "Los proyectos, por el nombre de su carpeta en projects/, en orden. Para esconder uno sin quitarlo: { \"project\": \"nombre\", \"visible\": false }.",
            "items": {
              "anyOf": [
                {
                  "type": "string"
                },
                {
                  "type": "object",
                  "required": [
                    "project",
                    "visible"
                  ],
                  "additionalProperties": false,
                  "properties": {
                    "project": {
                      "type": "string",
                      "description": "El nombre de su carpeta en projects/."
                    },
                    "visible": {
                      "type": "boolean",
                      "description": "false: tiene su página para mandarla, pero no sale en la home ni en Google."
                    }
                  }
                }
              ]
            }
          }
        }
      }
    },
    "gallery": {
      "type": "array",
      "description": "Las fotos de la home: una lista por botón (1, 2, 3); las fotos, en _portada/1/, _portada/2/…",
      "items": {
        "type": "array",
        "items": {
          "type": "object",
          "required": [
            "photo",
            "project"
          ],
          "additionalProperties": false,
          "properties": {
            "photo": {
              "type": "string",
              "pattern": "^[0-9]+$",
              "description": "El número de la foto en su carpeta de _portada/, sin .webp."
            },
            "project": {
              "type": "string",
              "description": "El proyecto al que lleva, por el nombre de su carpeta."
            },
            "desktop": {
              "type": "object",
              "additionalProperties": false,
              "properties": {
                "top": {
                  "type": "number",
                  "description": "Distancia desde arriba, en % de la pantalla."
                },
                "bottom": {
                  "type": "number",
                  "description": "Distancia desde abajo, en % de la pantalla."
                },
                "left": {
                  "type": "number",
                  "description": "Distancia desde la izquierda, en % de la pantalla."
                },
                "right": {
                  "type": "number",
                  "description": "Distancia desde la derecha, en % de la pantalla."
                },
                "scale": {
                  "type": "number",
                  "minimum": 0,
                  "description": "El tamaño."
                },
                "index": {
                  "type": "number",
                  "description": "Cuál va encima: el número más alto, delante."
                }
              },
              "description": "Dónde se coloca en ordenador."
            },
            "mobile": {
              "type": "object",
              "additionalProperties": false,
              "properties": {
                "top": {
                  "type": "number",
                  "description": "Distancia desde arriba, en % de la pantalla."
                },
                "bottom": {
                  "type": "number",
                  "description": "Distancia desde abajo, en % de la pantalla."
                },
                "left": {
                  "type": "number",
                  "description": "Distancia desde la izquierda, en % de la pantalla."
                },
                "right": {
                  "type": "number",
                  "description": "Distancia desde la derecha, en % de la pantalla."
                },
                "scale": {
                  "type": "number",
                  "minimum": 0,
                  "description": "El tamaño."
                },
                "index": {
                  "type": "number",
                  "description": "Cuál va encima: el número más alto, delante."
                }
              },
              "description": "Dónde se coloca en el móvil."
            }
          }
        }
      }
    }
  }
}
